Company Name,HQ Location,Industry,Headcount,Revenue,Offers Construction Admin,CA Management Tools,Construction Litigation,Project Focus Types,Open Job Titles and Dates,,
Cushing Terrell,Find contacts,"Billings, Montana, United States",Architecture & Planning,201-500,$100M-$250M,Yes - Their education and commercial service descriptions include “construction administration” support.,Procore,None found,"Mixed: commercial (~25%), education (~20%), healthcare (~15%), civic/government (~15%), multi-family & other residential (~15%), retail/industrial/inf",Yes. Examples: Certified Commissioning Engineer/Agent – 8d; BIM Coordinator – ~Jan 2026; roles with CA/QA/QC/documentation duties in descriptions.,Yes. Architectural Designer (construction admin support) – posted on EDG careers page (no date listed).
Adamson Associates Architects,Find contacts,"Toronto, Ontario, Canada",Architecture & Planning,201-500,$100M-$250M,Unclear,Research with AI,None found,Research with AI,No current CA/QA/QC/documentation tech roles; only design/technologist posts.,No current CA/QA/QC/tech/Doc Control roles; only Project Accountant (posted ~Dec 2025) and Senior HR & People & Culture Coordinator (posted ~Jun 2025)
Clark Nexsen,Find contacts,"Virginia Beach, Virginia, United States",Architecture & Planning,201-500,$100M-$250M,Yes - bridge engineering page lists “construction administration” among capabilities,Research with AI,None found,Research with AI,Unknown – no clearly labeled construction admin/CA/QA/QC/documentation tech roles found.,No current CA/QA/QC/tech openings; careers page lists no job openings.
McMillan Pazdan Smith Architecture,Find contacts,"Spartanburg, South Carolina, United States",Architecture & Planning,201-500,$100M-$250M,Yes - Their About page emphasizes “the construction administration process” as a key service.,Research with AI,None found,Research with AI,"Yes – “Specification Writer” (Greenville, SC), posted Jan 2026 (docs/specs & QC).",No current CA/QA/QC/documentation/technology openings; only architect roles listed.
Olson Kundig,Find contacts,"Seattle, Washington, United States",Architecture & Planning,201-500,$100M-$250M,Unclear,Research with AI,"Yes – at least two IP/business disputes, 6/13/2022 & 11/20/2023 (not construction).",Research with AI,Yes. Roles include Quality Control Manager – Architecture (posted ~mid-Jan 2026).,"Yes – Office Specialist (St. Louis, MO), posted Jan 2026 (admin/support role)."
Kasian Architecture Interior Design and Planning,Find contacts,"Vancouver, British Columbia, Canada",Architecture & Planning,201-500,$100M-$250M,Yes - job postings list “undertake site reviews and construction administration.”,Research with AI,None found,Research with AI,Yes. Construction‑admin–related roles: • Project Architect (Defence projects) – LinkedIn – posted ~Jan 2026 • Senior Project Architect (High‑Rise and,"Yes – Project Architect (Architecture) and Senior Project Manager – Construction (both 2025); also Administrative Assistant (Architecture, 2025)."
Lamar Johnson Collaborative,Find contacts,"Chicago, Illinois, United States",Architecture & Planning,201-500,$100M-$250M,Unclear,Research with AI,None found,Research with AI,"Yes. Example: “Project Architect – Residential” (LinkedIn, ~Jan 2026).",No current construction admin/CA-related roles found.
SMMA,Find contacts,"Cambridge, Massachusetts, United States",Architecture & Planning,201-500,$100M-$250M,Yes - SMMA mentions “construction contract administration” and staff providing “construction administration services” on its site.,Research with AI,None found,Research with AI,No current construction admin-related openings found on LinkedIn or SMMA careers.,"No relevant CA/QA/QC/tech construction admin jobs found as of Jan 28, 2026"
AO,Find contacts,"Orange, California, United States",Architecture & Planning,201-500,$100M-$250M,Unclear,Research with AI,None found,Research with AI,Unknown – no current AO construction admin/CA/QA/QC/documentation tech jobs found.,Yes. Roles include Project Designer (Construction Admin) – listed ~Jan 2026.
GreenbergFarrow,Find contacts,"Atlanta, Georgia, United States",Architecture & Planning,201-500,$100M-$250M,Yes - Their Architecture and Civil Engineering services lists include Construction Administration.,Research with AI,Yes – multiple contract disputes/litigation found (details below).,Research with AI,Unknown – no accessible listings found specifically for CA/QA/QC/doc roles.,"Yes – CAD/REVIT Technician (careers page, active as of Jan 2026)."
"LHB, Inc.",Find contacts,"Duluth, Minnesota, United States",Architecture & Planning,201-500,$100M-$250M,Yes - Mortarr lists construction administration among LHB’s areas of expertise.,Research with AI,"Dieter v. Gardner Builders Minneapolis, LLC et al. (filed Oct 23, 2020; ongoing as of Mar 11, 2022) – LHB, Inc. named as defendant/cross-claimant in a",Research with AI,Yes. Roles with CA/QA/QC elements are open; none titled “Construction Administrator.”,"Yes – Careers page lists roles with CA duties (e.g., Architectural Intern – “Assist in all phases…CDs and CA”), but no LinkedIn jobs; no explicit “CA/"
Bergmann,Find contacts,"Rochester, New York, United States",Architecture & Planning,201-500,$50M-$100M,Yes - Colliers/Bergmann service lists “Construction Administration” under structural services.,Research with AI,None found,Research with AI,"Yes – Preconstruction Manager – Design Management Support (includes CA & QA/QC), posted ~Jan 2026",No CA/QA/QC roles; current openings are engineering/interior design only.
Interplan LLC - Nationwide Development Architects and Engineers,Find contacts,"Altamonte Springs, Florida, United States",Architecture & Planning,51-200,$50M-$100M,Yes - Craft.co lists “construction administration services” as one of Interplan’s offerings.,Research with AI,"New CFH, LLC et al. v. Horizon General Contractors, Inc. et al., incl. Interplan, LLC (construction/design defects at Burger King, Tupelo, MS), filed",Research with AI,"Yes – e.g., “Architectural Project Coordinator” (posted ~Nov 2025; still active).",Yes – hiring a “Construction Administrator” (3+ yrs exp). Posting date not listed.
TPG Architecture,Find contacts,"New York, New York, United States",Architecture & Planning,51-200,$100M-$250M,Unclear,Research with AI,None found,Research with AI,Yes. Example CA-related roles: Project Architect (construction admin focus) – LinkedIn: posted ~Nov 2025; other current openings only listed via “care,"Yes. Project Manager (incl. construction admin) – job posted on or before Jan 26, 2026."
TowerPinkster,Find contacts,"Kalamazoo, Michigan, United States",Architecture & Planning,51-200,$50M-$100M,Yes - job postings and team roles describe leading projects through the Construction Administration phase,Research with AI,None found,Research with AI,Yes. Careers page lists “Project Architect” (posted ~Jan 2026) with construction admin duties.,"No current CA/QA/QC/documentation/tech job posts found for EDI International, PC"
Boulder Associates,Find contacts,"Boulder, Colorado, United States",Architecture & Planning,201-500,$100M-$250M,Yes - their Qdexx profile lists “construction administration services” among offerings.,Research with AI,None found,Research with AI,"No current CA/QA/QC/documentation tech roles; recent CA-related roles were: - Architect II – Charlotte, NC (includes construction administration; job,",No CA/QA/QC/documentation tech roles; only Architect & Interior Designer roles listed.
Kirksey Architecture,Find contacts,"Houston, Texas, United States",Architecture & Planning,201-500,$100M-$250M,Yes - Services list includes Construction Administration among offerings.,Research with AI,None found,Research with AI,Yes. Project Administrative Assistant – Construction Administration (posted ~mid‑Jan 2026).,No current CA/QA/QC/tech construction admin roles found.
OTJ Architects,Find contacts,"Washington, District Of Columbia, United States",Architecture & Planning,201-500,$100M-$250M,Yes - bios describe overseeing projects through construction administration and close-out,Research with AI,None found,Research with AI,"No construction admin roles; only Summer Intern (various cities) and Junior Interior Architect (Arlington, VA), all posted ~1 day ago.","Yes – e.g., Project Administration Assistant (Abbotsford, BC) – listed on careers page (active as of Jan 22, 2026)."
"Marx|Okubo Associates, Inc.",Find contacts,"Denver, Colorado, United States",Architecture & Planning,201-500,$100M-$250M,Yes - services list includes “monitoring of repair process during construction” and managing bids.,Research with AI,None found,Research with AI,"Yes. LinkedIn shows “Construction Project Manager” (Seattle & Portland, both posted ~Dec 2025; CA/owner‑rep role).","Yes – no CA/QA-specific roles; closest is Interior Designer (Austin & Houston, posted on careers page by Jan 28, 2026)."
Cuhaci Peterson®,Find contacts,"Maitland, Florida, United States",Architecture & Planning,201-500,$100M-$250M,Yes - LinkedIn specialties list “Construction Administration” as a service.,Research with AI,None found,Research with AI,"No active construction admin-related job postings found as of Jan 28, 2026.",No current CA/QA/QC/documentation/tech openings found; 0 construction admin jobs listed.
Ennead Architects,Find contacts,"New York, New York, United States",Architecture & Planning,51-200,$100M-$250M,Yes - their services include full project delivery through construction administration per project RFQs and federal A/E contracts.,Research with AI,None found,Research with AI,No current CA/QA/QC/documentation tech roles; no construction admin jobs listed.,"No active CA/QA/QC/tech construction admin jobs found as of Jan 28, 2026."
Lionakis,Find contacts,"Sacramento, California, United States",Architecture & Planning,51-200,$100M-$250M,Yes - Project pages note Lionakis provides “construction administration support.”,Research with AI,None found,Research with AI,"Yes. Architect (All Levels) – includes construction administration; posted Jan 27, 2026.",No current CA/QA/QC/documentation tech roles found; no construction admin jobs listed.
Hoefer Welker,Find contacts,"Kansas City, Missouri, United States",Architecture & Planning,51-200,$100M-$250M,Yes - Interior Design services page lists “Construction Administration” among offerings,Research with AI,None found,Research with AI,"Yes – Technology/Low Voltage Designer (posted ~May 2025, tech CA-focused).",
"Epstein Architecture, Engineering and Construction",Find contacts,"Chicago, Illinois, United States",Architecture & Planning,201-500,$50M-$100M,Unclear,Research with AI,None found,Research with AI,Unknown – no clearly current CA/QA/QC or construction admin job postings found.,
BSB Design,Find contacts,"West Des Moines, Iowa, United States",Architecture & Planning,201-500,$100M-$250M,Unclear,Research with AI,"Vista Holdings, LLC v. BSB Design, Inc. (construction contract dispute) – filed Nov 22, 2024, ongoing as of July 15, 2025; sources: Justia, Leagle,Law",Research with AI,"Yes. Example: “Construction Phase Architect,” posted Oct 23, 2025 (careers site).",
Steinberg Hart,Find contacts,"Los Angeles, California, United States",Architecture & Planning,51-200,$250M-$500M,Yes - BuilderOnline lists “Construction Administration” among Steinberg Hart’s services.,Research with AI,None found,Research with AI,"Yes. Example CA-related roles: Job Captain – Los Angeles (posted Jan 2026 est.), Job Captain – San Francisco (posted Jan 2026 est.).",
Bermello Ajamil & Partners,Find contacts,"Coral Gables, Florida, United States",Architecture & Planning,51-200,$50M-$100M,Yes - Their project scopes explicitly include “construction administration.”,Research with AI,None found,Research with AI,"No current CA/QA/QC/tech openings; last related was “Architectural Designer – Healthcare,” posted 08-01-2024.",
Beyer Blinder Belle,Find contacts,"New York, New York, United States",Architecture & Planning,51-200,$50M-$100M,Yes - Careers page lists a “Project Architect- Construction Administration” role.,Research with AI,None found,Research with AI,"Yes. Project Architect – Construction Administration (Miami, FL) – listed on BBB careers page; posting live as of Jan 2026.",
Davis Partnership Architects,Find contacts,"Denver, Colorado, United States",Architecture & Planning,51-200,$100M-$250M,Unclear,Research with AI,Yes – one case found.,Research with AI,"No current CA/QA/QC/documentation tech roles found as of Jan 28, 2026.",
TEECOM,Find contacts,"San Francisco, California, United States",Architecture & Planning,51-200,$50M-$100M,Yes - IT Project Management services include coordination during construction,Research with AI,None found,Research with AI,"Yes – roles like “Associate – Project Manager I” (Remote, US, posted late 2025) but no explicit Construction Admin titles found.",
McCoy Rockford,Find contacts,"Houston, Texas, United States",Architecture & Planning,201-500,$50M-$100M,Unclear,Research with AI,None found,Research with AI,"Yes – e.g., Project Manager (Austin) – posted Dec 2, 2025 (updated Jan 22, 2026).",
"HUNT Engineers, Architects & Surveyors",Find contacts,"Horseheads, New York, United States",Architecture & Planning,51-200,$50M-$100M,Yes - Their services list explicitly includes “construction administration.”,Research with AI,None found,Research with AI,"Yes – e.g., Site/Civil Engineer (5–9 Years Exp), posted ~Jan 22 2026; roles note bidding & construction administration.",
"Sheehan Nagle Hartray Architects, a Woolpert Company",Find contacts,"Chicago, Illinois, United States",Architecture & Planning,51-200,$50M-$100M,Unclear,Research with AI,None found,Research with AI,"No active CA/QA/QC/tech construction admin roles found as of Jan 28, 2026.",
Fieldstone A&E,Find contacts,"Auburn Hills, Michigan, United States",Architecture & Planning,51-200,$50M-$100M,"Yes - About page says they balance design principles, construction administration and technical expertise.",Research with AI,None found,Research with AI,"Yes – e.g., Data Entry Specialist (lot documentation), posted mid‑Jan 2026.",
KAI Enterprises,Find contacts,"St. Louis, Missouri, United States",Architecture & Planning,51-200,$50M-$100M,Unclear,Research with AI,"Yes – at least one case found (fraud suit filed Jan 12, 2024; STL County Circuit Court).",Research with AI,"Yes – current CA-related roles on careers site: • Construction Administrator – posted Jan 14, 2026 • Project Engineer (Construction Administration) –",
"Integrus Architecture, P.S.",Find contacts,"Spokane, Washington, United States",Architecture & Planning,51-200,$100M-$250M,Unclear,Research with AI,None found,Research with AI,"Yes. Structural Engineer – Spokane, WA (LinkedIn job, posted ~1 week ago).",
Zyscovich,Find contacts,"Miami, Florida, United States",Architecture & Planning,51-200,$50M-$100M,Yes - services list includes “Construction Administration” among firm keywords,Research with AI,None found,Research with AI,"Yes – e.g., “Senior Construction Administrator,” posted Dec 25, 2024 (Miami, FL).",
pb2 architecture + engineering,Find contacts,"Rogers, Arkansas, United States",Architecture & Planning,51-200,$50M-$100M,Yes - Their Architecture services page lists “Construction Administration” as a service.,Research with AI,None found,Research with AI,"No current construction admin/CA roles found; last related: Permit Coordinator – posted Dec 11, 2024 (closed Jan 26, 2025).",
BC2,Find contacts,"Montréal, Quebec, Canada",Architecture & Planning,51-200,$10M-$25M,Yes - Their landscape architecture services include “Surveillance de chantier” (site supervision).,Research with AI,None found,Research with AI,"Yes – e.g., “Coordonnateur(trice) Appel d’Offres (Temporaire 13 mois)” (posted Jan 2026).",
Precis Engineering + Architecture,Find contacts,"Ambler, Pennsylvania, United States",Architecture & Planning,51-200,$50M-$100M,Yes - their Project Management services list “Construction administration.”,Research with AI,None found,Research with AI,"No current construction admin/CA/QA/QC roles; only Sr Mechanical (Ambler & Cary), Sr Electrical (Cary), Sr Plumbing (Ambler), and Business Development",
Vestal Corporation,Find contacts,"Chesterfield, Missouri, United States",Architecture & Planning,51-200,$25M-$50M,Yes - Services list includes construction observation under Industrial Process Division.,Research with AI,None found,Research with AI,"Yes – e.g., “Senior Structural Designer” (San Antonio, posted ~2 days ago).",
Omicron,Find contacts,"Vancouver, British Columbia, Canada",Architecture & Planning,51-200,$50M-$100M,Unclear,Research with AI,None found,Research with AI,"Project Coordinator – Construction (project admin role), posted Apr 4, 2025 (Vancouver, BC).",
Chipman Design Architecture,Find contacts,"Des Plaines, Illinois, United States",Architecture & Planning,51-200,$25M-$50M,Yes - Services page lists “Construction Administration” with details of managing projects from construction kick-off to turnover.,Research with AI,None found,Research with AI,Yes. Careers page lists: Project Associate (undated) and Project Manager (undated).,
CSHQA,Find contacts,"Boise, Idaho, United States",Architecture & Planning,51-200,$50M-$100M,Yes - Their Architecture services include “bidding and construction administration.”,Research with AI,None found,Research with AI,No relevant construction admin/CA/QA/QC/documentation/tech roles open at CSHQA now.,
exp Federal,Find contacts,"Chicago, Illinois, United States",Architecture & Planning,51-200,$50M-$100M,"Yes - projects page notes Construction Phase Services incl. technical assistance during construction and shop drawing/submittal review, indicating CA.",Research with AI,"Arcadis-EXP Federal JV and Legacy-EXP Federal JV GAO bid protests filed Dec 11–12, 2025; no construction litigation/claims found.",Research with AI,"Yes – “Quality Control Manager” (construction QA/QC), posted ~recently (active as of Jan 2026).",
Cordogan Clark,Find contacts,"Chicago, Illinois, United States",Architecture & Planning,51-200,$25M-$50M,Yes - Their services list explicitly includes “Construction Administration.”,Research with AI,None found,Research with AI,No current CA/QA/QC/document-control tech roles found for Cordogan Clark.,
Hariri Pontarini Architects,Find contacts,"Toronto, Ontario, Canada",Architecture & Planning,51-200,$10M-$25M,Yes - Described as full-service with partner involvement through all stages and expertise to rigorously oversee construction.,Research with AI,None found,Research with AI,No current construction admin/CA/QA/QC tech roles found,
Fogarty Finger,Find contacts,"New York, New York, United States",Architecture & Planning,51-200,$50M-$100M,Yes - Project descriptions note they handled “construction administration” services.,Research with AI,None found,Research with AI,"Yes. Examples: Senior Architectural Designer – Ground-up Studio (NY, posted Jan 8, 2026).",
Harrison Design,Find contacts,"Atlanta, Georgia, United States",Architecture & Planning,51-200,$50M-$100M,Unclear,Research with AI,None found,Research with AI,"No current CA/QA/QC/documentation tech roles; only “Architectural Job Captain” (Los Angeles, posted Dec 1, 2025) found.",
"RAND Engineering & Architecture, DPC",Find contacts,"New York, New York, United States",Architecture & Planning,51-200,$50M-$100M,"Yes - Website header: “specializing in building evaluation, design, and construction administration.”",Research with AI,None found,Research with AI,"Yes – roles include Project Architect/Engineer (construction admin focus) and Code & Zoning Team Associate, posted Jan 9–23, 2025 (approx.).",
"Howard L. Zimmerman Architects & Engineers, D.P.C.",Find contacts,"New York, New York, United States",Architecture & Planning,51-200,$25M-$50M,Unclear,Research with AI,"Yes – Cipriani Club Residences v. Howard L. Zimmerman Architects & Engrs. DPC (filed Jan 31, 2022; NY Supreme Ct. Index 650480/2022; App. Div. 1st Dep",Research with AI,No current CA/QA/QC/tech construction admin roles found,
Sense Engineering,Find contacts,"Toronto, Ontario, Canada",Architecture & Planning,11-50,$10M-$25M,"Yes - They list “construction monitoring, contract administration and project management” under services during construction.",Research with AI,None found,Research with AI,"Yes – e.g., “Project Associate – Building Restoration,” posted Jan 2026 (Toronto).",
Bohlin Cywinski Jackson,Find contacts,"Wilkes Barre, Pennsylvania, United States",Architecture & Planning,51-200,$50M-$100M,Unclear,Research with AI,None found,Research with AI,Unknown – no current CA/QA/QC/construction admin jobs visible on BCJ or LinkedIn.,
ESG | Architecture & Design,Find contacts,"Minneapolis, Minnesota, United States",Architecture & Planning,51-200,$50M-$100M,Unclear,Research with AI,None found,Research with AI,Yes. Careers page lists a “Construction Administrator” opening (no posting date given).,
"Ci Design, Inc.",Find contacts,"Baltimore, Maryland, United States",Architecture & Planning,51-200,$50M-$100M,Yes - Project pages note Ci delivers services ‘from design through construction administration.’,Research with AI,"ADUSA Distribution Services, LLC v. Ci Design, Inc., contract suit filed Oct 31, 2023 (Law360); no other relevant cases/news found.",Research with AI,"Yes. E.g., Project Architect – Baltimore, MD (posted Jan 2026, includes construction administration).",
REES,Find contacts,"Oklahoma City, Oklahoma, United States",Architecture & Planning,51-200,$100M-$250M,Yes - their Services page lists “Construction Administration” as a core service.,Research with AI,None found,Research with AI,No current CA/QA/QC/tech construction admin roles found.,
Goree,Find contacts,"Houston, Texas, United States",Architecture & Planning,51-200,$50M-$100M,Yes - services page lists “Construction Administration” among core services,Research with AI,"Yes – Feb 13, 2023 copyright suit: Powers Brown Architecture v. Goree Architects, Inc.",Research with AI,No current construction admin/CA/QA/QC/documentation/tech roles found.,
CetraRuddy Architecture,Find contacts,"New York, New York, United States",Architecture & Planning,51-200,$25M-$50M,Unclear,Research with AI,"Yes – involved in condo construction litigation (141 Fifth Ave.) through at least Jan 5, 2023.",Research with AI,"Yes. E.g., “Project Architect / Task Leader” (posted recently; involves CA).",
Torti Gallas + Partners,Find contacts,"Washington, District Of Columbia, United States",Architecture & Planning,51-200,$50M-$100M,"Yes - e.g., Belmont Affordable Housing lists Construction Administration as a service",Research with AI,None found,Research with AI,No CA/QA/QC/doc/tech construction admin roles currently listed.,
Peter Marino Architect,Find contacts,"New York, New York, United States",Architecture & Planning,51-200,$50M-$100M,Unclear,Research with AI,"Nahla Raleigh LLC v. BSD Raleigh Trustee LLC (re: Marino designs), filed Jan 2026 – The Real Deal, Jan 26 2026; no direct construction litigation/defm",Research with AI,No current CA/QA/QC/tech construction admin roles found,
"group 70 international, inc.",Find contacts,"Honolulu, Hawaii, United States",Architecture & Planning,51-200,$50M-$100M,Unclear,Research with AI,None found,Research with AI,No current CA/QA/QC/tech or construction admin jobs posted.,
The Architectural Team,Find contacts,"Chelsea, Massachusetts, United States",Architecture & Planning,51-200,$25M-$50M,Yes - Buzzfile lists “Construction Administration” among TAT’s services,Research with AI,None found,Research with AI,Yes. Careers page lists: Project Architect (posted ~Oct 2025) and Project Design Architect (~Oct 2025).,
Apogee Consulting Group,Find contacts,"Cary, North Carolina, United States",Architecture & Planning,51-200,$25M-$50M,Yes - SignalHire lists “Construction Management and Administration” among Apogee’s specialties.,Research with AI,None found,Research with AI,No CA/QA/QC/admin jobs found; only design/engineering roles posted.,
Kirkor Architects and Planners,Find contacts,"Toronto, Ontario, Canada",Architecture & Planning,51-200,$10M-$25M,Unclear,Research with AI,None found,Research with AI,"Yes – e.g., “Construction Administrator / Contract Administrator” (Toronto) – posted Jan 2026.",
"MVE + Partners, Inc.",Find contacts,"Irvine, California, United States",Architecture & Planning,51-200,$25M-$50M,"Yes – job descriptions note staff “handle construction administration” and “manage construction administration (RFIs, shop drawings, submittals, etc.)",Research with AI,None found,Research with AI,"Yes – e.g., Project Manager (Irvine, CA) – LinkedIn, posted Dec 2025 (CA-focused).",
BBB Architects,Find contacts,"Toronto, Ontario, Canada",Architecture & Planning,51-200,$10M-$25M,Unclear,Research with AI,None found,Research with AI,"Yes – e.g., “Specification Writer” (technical documentation), posted “Today” (Jan 28, 2026).",
MHTN Architects,Find contacts,"Salt Lake City, Utah, United States",Architecture & Planning,51-200,$50M-$100M,Yes - external firm profiles list Construction Administration among MHTN’s services,Research with AI,None found,Research with AI,"Yes – e.g., “Project Architect” (Construction Administration) – posted before Jan 28, 2026.",
