Fawley Bryant Architecture,Find contacts,"Lakewood Ranch, Florida, United States",Architecture & Planning,11-50,$10M-$25M,Yes - A 2025 contract scope explicitly includes “construction administration.”,Research with AI,Research with AI,Research with AI,"Yes – e.g., “Construction Administrator” on LinkedIn (posted Jan 2026).",
Ryan Street Architects,Find contacts,"Austin, Texas, United States",Architecture & Planning,11-50,$10M-$25M,"Yes - Their Phase V includes “bidding, negotiation & construction observation.”",Research with AI,Research with AI,Research with AI,No current construction admin/CA/QA/QC/tech roles; no relevant jobs listed.,
ERW Lighting + Controls,Find contacts,"Seattle, Washington, United States",Architecture & Planning,11-50,$10M-$25M,Unclear,Research with AI,Research with AI,Research with AI,No relevant CA/QA/QC/tech construction admin roles currently posted.,
MEP Designs Inc.,Find contacts,"Manassas, Virginia, United States",Architecture & Planning,11-50,$10M-$25M,"Yes - Their services list ""Engineering Construction Administration"" under Engineering Design Services.",Research with AI,Research with AI,Research with AI,Yes. Roles: Mechanical Engineer; Plumbing Engineer/Designer; Electrical Engineer (no specific CA admin titles listed).,
"Sustainable Design Consulting, LLC",Find contacts,"Richmond, Virginia, United States",Architecture & Planning,11-50,$10M-$25M,"Yes - Staff includes a “Senior Consultant, Construction Administration,” indicating such services.",Research with AI,Research with AI,Research with AI,"Yes. Current opening: “Senior Associate, Business Operations” (Richmond, VA) – listed on SDC careers page; no active construction admin/CA/QA/QC/tech/",
Carleton Hart Architecture PC,Find contacts,"Portland, Oregon, United States",Architecture & Planning,11-50,$10M-$25M,Unclear,Research with AI,Research with AI,Research with AI,No current CA/QA/QC/tech roles posted; only general career inquiries.,
Roger Ferris + Partners,Find contacts,"Westport, Connecticut, United States",Architecture & Planning,11-50,$10M-$25M,Unclear,Research with AI,Research with AI,Research with AI,No CA/QA/QC/tech construction admin roles; only Digital Communications Manager & Marketing Coordinator on careers page (no dates listed).,
"KG+D Architects, PC",Find contacts,"Mount Kisco, New York, United States",Architecture & Planning,11-50,$10M-$25M,Yes - Their services list includes “Construction Administration” with contract admin and site inspections.,Research with AI,Research with AI,Research with AI,No relevant CA/QA/tech openings; only architect roles with CA duties found.,
Camburas Theodore LTD,Find contacts,"Des Plaines, Illinois, United States",Architecture & Planning,11-50,$10M-$25M,Unclear,Research with AI,Research with AI,Research with AI,No current CA/QA/QC/tech construction admin jobs found on their site or LinkedIn.,
Architectural Lighting Alliance,Find contacts,"Dallas, Texas, United States",Architecture & Planning,51-200,$10M-$25M,No,Research with AI,Research with AI,Research with AI,No relevant construction admin/CA/QA/QC/documentation/tech jobs found.,
Modulus Consulting,Find contacts,"San Francisco, California, United States",Architecture & Planning,11-50,$10M-$25M,No,Research with AI,Research with AI,Research with AI,Yes – hiring Sr. BIM Specialist (posted ~3 weeks ago on LinkedIn).,
Architectural Design Guild,Find contacts,"St. Louis, Missouri, United States",Architecture & Planning,11-50,$10M-$25M,Yes - Services list explicitly includes “construction administration.”,Research with AI,Research with AI,Research with AI,"No relevant CA/QA/QC/tech job postings found as of Jan 28, 2026",
"Van Tilburg, Banvard & Soderbergh (VTBS Architects)",Find contacts,"Santa Monica, California, United States",Architecture & Planning,51-200,$10M-$25M,Unclear,Research with AI,Research with AI,Research with AI,No current CA/QA/QC/tech hiring found; no active construction admin job posts located.,
ALIGCUS Inc.,Find contacts,"San Gabriel, California, United States",Architecture & Planning,51-200,$10M-$25M,Unclear,Research with AI,Research with AI,Research with AI,"Yes – e.g., Architectural Job Captain (LinkedIn, ~Nov 2025); Construction Assistant (posted ~Jan 2025).",
MTFA Architecture,Find contacts,"Arlington, Virginia, United States",Architecture & Planning,11-50,$1M-$10M,Yes - Their services list explicitly includes construction administration.,Research with AI,Research with AI,Research with AI,"Yes – roles include Project Architect, Project Manager, Interior Designer, Preservation Architect, Architectural Conservator; postings active as of ~2",
TreHus Architects + Interior Designers + Builders,Find contacts,"Minneapolis, Minnesota, United States",Architecture & Planning,11-50,$1M-$10M,Unclear,Research with AI,Research with AI,Research with AI,No current CA/QA/QC/construction admin tech roles found.,
Weyland Ventures,Find contacts,"Louisville, Kentucky, United States",Architecture & Planning,11-50,$1M-$10M,Unclear,Research with AI,Research with AI,Research with AI,No CA/QA/QC/tech construction admin roles; only Facilities Maintenance Technician (posted ~10 days ago) and non-admin hospitality roles.,
Planworks Architecture Inc.,Find contacts,"Edmonton, Alberta, Canada",Architecture & Planning,11-50,$1M-$10M,"Yes - Their services list includes Contract Administration covering tendering, site supervision and construction phases.",Research with AI,Research with AI,Research with AI,"Yes – careers page lists Architectural Designer, Senior Architectural Technologist, Intermediate Architectural Technologist (no posting dates shown).",
KARDENT,Find contacts,"Long Beach, California, United States",Architecture & Planning,11-50,$25M-$50M,Yes - Their services list includes “Construction Administration” under Interior Architecture Services.,Research with AI,Research with AI,Research with AI,No current construction admin-related openings found.,
Somerset Steel & Lincoln Contracting,Find contacts,United States,Architecture & Planning,51-200,$25M-$50M,Unclear,Research with AI,Research with AI,Research with AI,No current CA/QA/QC/documentation/tech or construction admin jobs found.,
Rice's Landscapes Redefined,Find contacts,"Canton, Ohio, United States",Architecture & Planning,51-200,$10M-$25M,No,Research with AI,Research with AI,Research with AI,"No CA/QA/QC/tech admin roles; only field roles like Landscape Installation Crew Leader/Member and Maintenance Crew Leader/Member, no posting dates.",
Green View Companies,Find contacts,"Dunlap, Illinois, United States",Architecture & Planning,51-200,$10M-$25M,Unclear,Research with AI,Research with AI,Research with AI,"Yes. E.g., “Landscape Sales and Management Team” & “Landscape Design-Build Sales Consultant” in Dunlap (listed on careers page, posted ~38 days ago).",
HHF Planners,Find contacts,"Honolulu, Hawaii, United States",Architecture & Planning,11-50,$10M-$25M,Unclear,Research with AI,Research with AI,Research with AI,Yes. Current openings (careers page): Facilities and Land Use Planner; Facilities and Land Use Senior Planner; Land Use and Environmental Planner; GIS,
"WTW Architects, an AE Works company",Find contacts,"Pittsburgh, Pennsylvania, United States",Architecture & Planning,11-50,$10M-$25M,Yes - AE Works services list includes construction administration and project services.,Research with AI,Research with AI,Research with AI,Yes. “Assistant Project Manager/Building Construction” – posted ~37 days ago.,
S3DA Design,Find contacts,"San Diego, California, United States",Architecture & Planning,11-50,$10M-$25M,Unclear,Research with AI,Research with AI,Research with AI,No current CA/QA/QC/tech or construction admin job postings found.,
OLSON LEWIS + Architects,Find contacts,"Manchester, Massachusetts, United States",Architecture & Planning,11-50,$10M-$25M,Yes - Their process explicitly lists “construction administration” as a project phase.,Research with AI,Research with AI,Research with AI,"Yes – Interior Designer (3–5 yrs exp), posted on OL+ careers page (no date listed).",
Beecher Walker,Find contacts,United States,Architecture & Planning,11-50,$10M-$25M,Unclear,Research with AI,Research with AI,Research with AI,"Yes – Architectural Designer + Revit Pro; Senior Design Architect (posted on careers page, dates not listed).",
MG Architects,Find contacts,"Houston, Texas, United States",Architecture & Planning,11-50,$10M-$25M,Yes - Project Management page lists Construction Administration as a service,Research with AI,Research with AI,Research with AI,No current openings; no CA/QA/QC/tech construction admin jobs posted.,
BSE Engineering,Find contacts,"San Diego, California, United States",Architecture & Planning,11-50,$10M-$25M,Unclear,Research with AI,Research with AI,Research with AI,No relevant CA/QA/QC/tech construction admin roles posted.,
FH Design,Find contacts,"Nashville, Tennessee, United States",Architecture & Planning,11-50,$1M-$10M,Yes - Sponsor profile notes they offer “construction administration” among services.,Research with AI,Research with AI,Research with AI,No current construction admin-related roles found for FH Design.,
BLTA,Find contacts,"Montréal, Quebec, Canada",Architecture & Planning,11-50,$1M-$10M,Unclear,Research with AI,Research with AI,Research with AI,No current CA/QA/QC/documentation/technology roles found for BLTA.,
"RCI Engineering, Inc.",Find contacts,"Davie, Florida, United States",Architecture & Planning,11-50,$1M-$10M,Yes - site notes they respond quickly to keep momentum and avoid delays during construction administration,Research with AI,Research with AI,Research with AI,"Yes – hiring Project Coordinator (construction admin-related), posted on careers page (no date listed).",
"Fusion Design Consultants, Inc.",Find contacts,"Boston, Massachusetts, United States",Architecture & Planning,11-50,$1M-$10M,Unclear,Research with AI,Research with AI,Research with AI,Yes – hiring Project Manager and Assistant Project Manager (no dates listed).,
"UrbanWorks, Ltd.",Find contacts,"Chicago, Illinois, United States",Architecture & Planning,11-50,$1M-$10M,Yes - Services list on PropJump explicitly includes “Construction Administration.”,Research with AI,Research with AI,Research with AI,No current CA/QA/QC/tech construction admin openings found.,
C2 Collaborative,Find contacts,"San Clemente, California, United States",Architecture & Planning,11-50,$1M-$10M,Unclear,Research with AI,Research with AI,Research with AI,"Yes – hiring Project Designer and Job Captain (design/tech roles), posted on careers page (no CA/QA/QC/admin listings).",
Peterssen/Keller Architecture,Find contacts,"Minneapolis, Minnesota, United States",Architecture & Planning,11-50,$1M-$10M,"Yes - Their process page lists “Construction Administration” as Step 9 with on-site visits, review of shop drawings, and oversight during construction",Research with AI,Research with AI,Research with AI,"Yes. Roles: Designer and Drafter (careers page, posted 2026). No CA/QA/QC-specific jobs.",
"Sawyer | Berson Architecture & Landscape Architecture, LLP",Find contacts,"New York, New York, United States",Architecture & Planning,11-50,$1M-$10M,Unclear,Research with AI,Research with AI,Research with AI,"No current CA/QA/QC/tech openings found; only prior “Intermediate Level Architect” posting (Mar 26, 2024).",
"C2 Design Group, LLC",Find contacts,"Schenectady, New York, United States",Architecture & Planning,11-50,$1M-$10M,Unclear,Research with AI,Research with AI,Research with AI,Yes – Architectural Designer (QA/QC/CA focus) – posted on Indeed c. Dec 2025,
"Dell Consulting, LLC.",Find contacts,"Pensacola, Florida, United States",Architecture & Planning,11-50,$1M-$10M,Yes - their capabilities include “construction administration” on DoD projects.,Research with AI,Research with AI,Research with AI,"Yes – AutoCAD/Revit Drafting Technician (construction documents), posted on Indeed; date not shown.",
Via Design Inc.,Find contacts,"Grand Rapids, Michigan, United States",Architecture & Planning,11-50,$1M-$10M,Unclear,Research with AI,Research with AI,Research with AI,No current construction admin/CA/QA/QC/doc/tech roles found; no relevant job postings listed.,
Un architecture inc,Find contacts,"Montréal, Quebec, Canada",Architecture & Planning,11-50,$1M-$10M,Yes - Their services include “suivi de chantier” (site/construction monitoring).,Research with AI,Research with AI,Research with AI,Yes – roles: “Architecte ou Technologue” and “Gestionnaire BIM (Architecture)” (see careers page; dates not listed).,
M Designs Architects,Find contacts,"Palo Alto, California, United States",Architecture & Planning,11-50,$1M-$10M,Unclear,Research with AI,Research with AI,Research with AI,Yes – hiring a “Lead Architect – Pakistan Office” (listed on careers page; date not shown).,
HDR | CEI,Find contacts,"Vancouver, British Columbia, Canada",Architecture & Planning,51-200,$1M-$10M,Unclear,Research with AI,Research with AI,Research with AI,"Yes – e.g., Project Architect (Vancouver, BC) with construction contract administration/QA/QC duties, posted ~Dec 2025 on LinkedIn.",
TBA Studio,Find contacts,"West Monroe, Louisiana, United States",Architecture & Planning,11-50,$50M-$100M,Yes - Their services list explicitly includes “Construction Administration.”,Research with AI,Research with AI,Research with AI,"Yes – hiring Project Coordinator (Ops, Bossier City) posted Oct 20, 2025.",
APPAREIL Architecture,Find contacts,"Montréal, Quebec, Canada",Architecture & Planning,11-50,$50M-$100M,Yes - Their about page lists “support for tenders and construction sites” as a service.,Research with AI,Research with AI,Research with AI,No current CA/QA/QC/documentation tech roles found.,
The M Group Architects,Find contacts,"Reston, Virginia, United States",Architecture & Planning,11-50,$10M-$25M,Unclear,Research with AI,Research with AI,Research with AI,No current CA/QA/QC/documentation tech roles found,
HDI Railing Systems,Find contacts,"Columbia, Pennsylvania, United States",Architecture & Planning,51-200,$10M-$25M,Unclear,Research with AI,Research with AI,Research with AI,Yes – Assistant Project Manager (8 days ago) and Quality Control Inspector (15 days ago) on Indeed.,
"Architects Lewis + Whitlock, PA",Find contacts,"Tallahassee, Florida, United States",Architecture & Planning,11-50,$10M-$25M,Yes - Architect Magazine lists “Construction Administration” among their services.,Research with AI,Research with AI,Research with AI,Architectural Designer III – posting date not listed,
"Urban Architectural Initiatives, RA, PC",Find contacts,"New York, New York, United States",Architecture & Planning,11-50,$10M-$25M,Yes - Their qualifications note experience “administrating construction contracts.”,Research with AI,Research with AI,Research with AI,"Yes – hiring a Junior Architect (construction admin-related) posted Jan 12, 2026.",
"SWA Architects (Pasadena, CA)",Find contacts,"Pasadena, California, United States",Architecture & Planning,11-50,$10M-$25M,Unclear,Research with AI,Research with AI,Research with AI,"Yes – “Healthcare Construction Administrator Project Manager” (construction admin), plus other design/PM roles; all active on Indeed in late 2025 (no",
"KdG, a division of Shive-Hattery, Inc.",Find contacts,"St. Louis, Missouri, United States",Architecture & Planning,11-50,$10M-$25M,Unclear,Research with AI,Research with AI,Research with AI,"Yes. Example: Construction Administrator – Iowa City / Cedar Rapids / West Des Moines, posted Jan 2026 (Shive-Hattery careers).",
Sudbury Design Group,Find contacts,"Sudbury, Massachusetts, United States",Architecture & Planning,11-50,$10M-$25M,Unclear,Research with AI,Research with AI,Research with AI,No current CA/QA/QC/tech or construction admin roles found.,
GOODE VAN SLYKE Architecture,Find contacts,"Atlanta, Georgia, United States",Architecture & Planning,11-50,$10M-$25M,Yes - Their About page lists “Construction Administration” under Design services.,Research with AI,Research with AI,Research with AI,Open roles: Project Manager; Project Architect/Designer; Staff Architect/Designer (no CA-specific titles or dates listed).,
"Danze & Davis Architects, Inc.",Find contacts,"Austin, Texas, United States",Architecture & Planning,11-50,$10M-$25M,Unclear,Research with AI,Research with AI,Research with AI,No relevant CA/QA/QC/tech construction admin roles found.,
GARVIN DESIGN GROUP,Find contacts,"Columbia, South Carolina, United States",Architecture & Planning,11-50,$10M-$25M,Unclear,Research with AI,Research with AI,Research with AI,No current CA/QA/QC/tech openings; no construction admin jobs listed.,
BarnesVanze Architects,Find contacts,"Washington, District Of Columbia, United States",Architecture & Planning,11-50,$10M-$25M,Unclear,Research with AI,Research with AI,Research with AI,No current construction admin/CA/QA/QC/tech job postings found,
"Keystone Associates Architects, Engineers and Surveyors, LLC",Find contacts,"Binghamton, New York, United States",Architecture & Planning,11-50,$10M-$25M,Yes - civil and municipal engineering services include “construction phase services.”,Research with AI,Research with AI,Research with AI,"Yes – Environmental Scientist (Binghamton, NY), posted on Keystone site (no CA admin role).",
KSH Architects,Find contacts,"San Francisco, California, United States",Architecture & Planning,11-50,$10M-$25M,Unclear,Research with AI,Research with AI,Research with AI,No current CA/QA/QC/tech construction admin roles found,
Posen Architects LLC,Find contacts,"West Orange, New Jersey, United States",Architecture & Planning,11-50,$10M-$25M,Unclear,Research with AI,Research with AI,Research with AI,"Yes – Junior Architect – Revit (posted Jun 17, 2025) and Intermediate Architect – Revit (posted Sep 5, 2025).",
Architectural Building Supply,Find contacts,"Salt Lake City, Utah, United States",Architecture & Planning,51-200,$10M-$25M,No,Research with AI,Research with AI,Research with AI,No current CA/QA/QC/tech or construction admin job postings found.,
"EDM Engineering & Landscape Architecture, P.C.",Find contacts,"Pittsfield, Massachusetts, United States",Architecture & Planning,11-50,$1M-$10M,Unclear,Research with AI,Research with AI,Research with AI,No CA/QA/QC/documentation roles; only engineering/design roles on careers page.,
DMAC Architecture & Interiors,Find contacts,"Evanston, Illinois, United States",Architecture & Planning,11-50,$1M-$10M,Unclear,Research with AI,Research with AI,Research with AI,No current CA/QA/QC/tech job postings; no construction admin roles listed.,
TNI Group,Find contacts,"Los Angeles, California, United States",Architecture & Planning,11-50,$1M-$10M,Yes - their listed services explicitly include “construction administration”,Research with AI,Research with AI,Research with AI,No current CA/QA/QC/tech or construction admin job postings found.,
EV&A Architects,Find contacts,"Las Vegas, Nevada, United States",Architecture & Planning,11-50,$1M-$10M,Unclear,Research with AI,Research with AI,Research with AI,No current CA/QA/QC/construction admin job postings found.,
STUDIO V,Find contacts,"New York, New York, United States",Architecture & Planning,11-50,$1M-$10M,Unclear,Research with AI,Research with AI,Research with AI,"Yes. “Project Manager” (Archinect, posted Jul 30, 2025) – includes CA responsibilities.",
VCA Green,Find contacts,"Orange, California, United States",Architecture & Planning,51-200,$1M-$10M,Unclear,Research with AI,Research with AI,Research with AI,"Yes. LEED Project Manager, Energy Modeler, and Project Manager (no dates shown).",
"Chesney Morales Partners, Inc.",Find contacts,"San Antonio, Texas, United States",Architecture & Planning,11-50,$1M-$10M,Yes - Their services list explicitly includes “Construction Administration.”,Research with AI,Research with AI,Research with AI,"No current CA/QA/QC/tech openings; last relevant role was “Architectural Coordinator (Non‑Licensed)” posted July 6, 2025.",
ajc architects,Find contacts,"Salt Lake City, Utah, United States",Architecture & Planning,11-50,$1M-$10M,Yes - their firm description says they provide “construction administration services” nation-wide.,Research with AI,Research with AI,Research with AI,Only a Project Architect role (with CA duties) found; posted on Indeed before Aug 2025 (exact date not listed).,
DesignCell,Find contacts,"Las Vegas, Nevada, United States",Architecture & Planning,11-50,$1M-$10M,"Yes - services list ""Full Spectrum Construction Administration Services"" and text cites focus through construction administration",Research with AI,Research with AI,Research with AI,"Architectural Designer (LinkedIn, posted ~Jan 2026); Architectural Project Manager (Scottsdale, AZ – active listing; careers page).",
"RKAA Architects, Inc",Find contacts,"Phoenix, Arizona, United States",Architecture & Planning,11-50,$1M-$10M,Yes - Services page lists “construction administration services” and “Construction Drawings / Construction Administration.”,Research with AI,Research with AI,Research with AI,"Yes – Architectural Construction Administrator (Phoenix, AZ), posted ~Oct 2025 on Indeed.",
Site Workshop Landscape Architecture,Find contacts,"Seattle, Washington, United States",Architecture & Planning,11-50,$1M-$10M,Yes - Services list includes “construction administration” on their What We Do page.,Research with AI,Research with AI,Research with AI,"Yes. Example CA-related role: “Landscape Architect/Designer” – posted Dec 25, 2025 (WASLA).",
"DDG Virginia Engineering, PC",Find contacts,"Fairfax, Virginia, United States",Architecture & Planning,11-50,$1M-$10M,Yes - Services page lists “Construction Administration” with description,Research with AI,Research with AI,Research with AI,"Yes. Mechanical Design Engineer – Construction Admin support – posted Feb 13, 2025 (Mercer Univ board).",
fc STUDIO inc,Find contacts,"Chicago, Illinois, United States",Architecture & Planning,11-50,$50M-$100M,Yes - Services page lists “New Construction – FULL service…through construction” and “Project & Construction Management.”,Research with AI,Research with AI,Research with AI,No current CA/QA/QC/tech or construction admin job postings found.,
Wine Cellar Innovations,Find contacts,"Cincinnati, Ohio, United States",Architecture & Planning,51-200,$25M-$50M,Unclear,Research with AI,Research with AI,Research with AI,"No; company closed June 14, 2022—no current construction admin/CA roles.",
Bates,Find contacts,"Springfield, Missouri, United States",Architecture & Planning,51-200,$10M-$25M,Unclear,Research with AI,Research with AI,Research with AI,No current CA/QA/QC construction admin roles found.,
Hawks Landscape,Find contacts,"Wauwatosa, Wisconsin, United States",Architecture & Planning,51-200,$10M-$25M,Unclear,Research with AI,Research with AI,Research with AI,No current construction admin/CA/QA/QC/tech roles found,
Morgan Gick McBeath & Associates (MGMA),Find contacts,"Falls Church, Virginia, United States",Architecture & Planning,11-50,$10M-$25M,"Yes – site notes MGMA oversees every aspect of the construction phase, from groundbreaking to completion, providing support and quality control to see",Research with AI,Research with AI,Research with AI,No current CA/QA/QC/tech openings; no construction admin jobs listed.,
Charles Cunniffe Architects,Find contacts,"Aspen, Colorado, United States",Architecture & Planning,11-50,$10M-$25M,Unclear,Research with AI,Research with AI,Research with AI,No current construction admin-related openings found.,
Designhaus Architecture,Find contacts,"Auburn Hills, Michigan, United States",Architecture & Planning,11-50,$10M-$25M,Unclear,Research with AI,Research with AI,Research with AI,"Yes – hiring Project Manager, AutoCAD Designer, Project Architect (ongoing, careers page).",
Di Cara | Rubino Architects,Find contacts,"Parsippany, New Jersey, United States",Architecture & Planning,11-50,$10M-$25M,Yes - their firm description says they handle all phases “to construction administration.”,Research with AI,Research with AI,Research with AI,No current construction admin/CA-related openings found.,
"Martenson & Eisele, Inc",Find contacts,"Menasha, Wisconsin, United States",Architecture & Planning,11-50,$10M-$25M,"Yes - Engineering services page lists “construction administration” for trails, culverts and bridges.",Research with AI,Research with AI,Research with AI,"No relevant construction admin job postings found as of Jan 28, 2026.",
Wilkins Architecture Design Planning,Find contacts,"Kearney, Nebraska, United States",Architecture & Planning,11-50,$10M-$25M,Yes - Their services list includes “Construction Administration” under Architectural Services.,Research with AI,Research with AI,Research with AI,"Yes – “Construction Administrator” (careers page, no posting date listed).",
Ronnette Riley Architect,Find contacts,"New York, New York, United States",Architecture & Planning,11-50,$10M-$25M,Research with AI,Research with AI,Research with AI,Research with AI,No current construction admin/CA/QA/QC/documentation/tech jobs found.,
MULTATECH,Find contacts,"Fort Worth, Texas, United States",Architecture & Planning,51-200,$10M-$25M,Research with AI,Research with AI,Research with AI,Research with AI,No current CA/QA/QC/tech construction admin jobs found for MULTATECH.,
Cutler,Find contacts,"Vancouver, British Columbia, Canada",Architecture & Planning,11-50,$1M-$10M,Research with AI,Research with AI,Research with AI,Research with AI,No current CA/QA/QC/tech openings found for Cutler; no construction admin roles listed.,
